11C0001279,SURGICAL CENTER FOR UROLOGY LLC,290 COUNTRY CLUB DR SUITE 240,STOCKBRIDGE,GA,30281,,(678) 565-1806,97,3,0,98,90,8,2,94,91,7,2,96,91,7,2,96,,1884,365,20,01/01/2022,12/31/2022
11C0001368,NORTH COLUMBUS SURGERY CENTER LLC,7351 OLD MOON RD,COLUMBUS,GA,31909,,(706) 653-7000,97,2,1,98,92,6,2,95,80,17,3,93,87,11,2,95,,3061,531,18,01/01/2022,12/31/2022
11C0001370,GEORGIA SPINE SURGERY CENTER LLC DBA GNS SURGERY CENTER,1061 DOWDY RD SUITE 103,ATHENS,GA,30606,,(706) 543-9222,,,,,,,,,,,,,,,,,4,,,,,
11C0001383,HUGHSTON SURGICAL CENTER LLC,6262 VETERANS PKWY UNIT. B,COLUMBUS,GA,31909,,(706) 494-3434,,,,,,,,,,,,,,,,,4;5,,,,,
11C0001407,WHITE OAK SURGERY CENTER,1665 EAST HWY 34 SUITE 200,NEWMAN,GA,30265,,(770) 252-7557,,,,,,,,,,,,,,,,,4,,,,,
11C0001460,RESURGENS EAST SURGERY CENTER LLC,3241 IRIS DR SUITE 100,COVINGTON,GA,30016,,(678) 712-7624,98,2,0,99,94,4,2,96,92,7,1,96,90,9,1,96,,1262,319,25,01/01/2022,12/31/2022
11C0001472,RESURGENS FAYETTE SURGERY CENTER LLC,1336 HWY 54 WEST BUILDING 400 SUITE A,FAYETTEVILLE,GA,30214,,(678) 251-0200,99,1,0,99,92,7,1,96,94,4,2,97,92,6,2,96,,1500,475,32,01/01/2022,12/31/2022
12C0001012,KAISER PERMANENTE HONOLULU CLINIC ASC,1010 PENSACOLA ST,HONOLULU,HI,96814,,(808) 597-2611,99,1,0,99,93,6,1,96,92,7,1,96,89,10,1,96,,2271,825,37,01/01/2022,12/31/2022
12C0001100,KAISER WAILUKU CLINIC ASC,80 MAHALANI ST,WAILUKU,HI,96793,,(808) 243-6000,99,1,0,99,94,4,2,96,88,11,1,96,88,11,1,96,,1512,487,32,01/01/2022,12/31/2022
13C0001037,KOOTENAI OUTPATIENT SURGERY,707 WEST IRONWOOD DR,COEUR D ALENE,ID,83814,,(308) 625-6428,99,1,0,99,92,7,1,95,91,7,2,95,86,12,2,95,,1510,395,27,01/01/2022,12/31/2022
13C0001064,IDAHO PHYSICAL MEDICINE AND REHABILITATION PA,3551 EAST OVERLAND RD,MERIDIAN,ID,83642,,(208) 287-6558,98,2,0,99,94,5,1,97,91,9,0,96,87,12,1,95,,1204,320,27,01/01/2022,12/31/2022
14C0001030,RIVER NORTH SAME DAY SURGERY LLC,1 EAST ERIE ST SUITE 300,CHICAGO,IL,60611,,(312) 649-9706,98,2,0,99,92,6,2,95,88,9,3,94,84,14,2,93,,1614,346,21,01/01/2022,12/31/2022
14C0001041,NORTH SHORE SAME DAY SURGERY DBA NORTH SHORE SURGICAL CENTER,3427 WEST TOUHY AVE,LINCOLNWOOD,IL,60712,,(847) 324-7770,95,4,1,97,92,7,1,95,81,16,3,92,79,18,3,92,,1474,561,38,01/01/2022,12/31/2022
14C0001059,ROCKFORD GASTROENTEROLOGY ASSOCIATES LTD,401 ROXBURY RD,ROCKFORD,IL,61107,,(815) 484-7930,98,2,0,99,89,9,2,93,91,8,1,96,95,5,0,98,,1876,347,19,01/01/2022,12/31/2022
14C0001074,EFFINGHAM SURGICAL PARTNERS LLC,904 W. TEMPLE AVE.,EFFINGHAM,IL,62401,,(217) 342-1234,99,1,0,99,94,5,1,97,94,5,1,97,92,7,1,96,,1032,412,40,01/01/2022,12/31/2022
14C0001157,PHYSICIANS SURGERY CENTER AT GOOD SAMARITAN LLC,"2 GOOD SAMARITAN WAY, STE. 200",MOUNT VERNON,IL,62864,,(618) 899-5703,98,2,0,99,91,8,1,95,88,10,2,95,82,17,1,93,,1288,394,31,01/01/2022,12/31/2022
14C0001172,SILVER CROSS AMBULATORY SURGERY CENTER LLC DBA SILVER CROSS SURGERY CENTER,1003 PAWLAK PARKWAY,NEW LENOX,IL,60451,,(815) 717-1740,97,2,1,98,92,6,2,95,90,8,2,95,87,11,2,95,,1415,538,38,01/01/2022,12/31/2022
14C0001178,PALOS HEALTH SURGERY CENTER,15300 WEST AVE SUITE 260,ORLAND PARK,IL,60462,,(708) 981-3664,,,,,,,,,,,,,,,,,4,,,,,
15C0001158,TERRE HAUTE SURGICAL CENTER LLC,227 EAST MCCALLISTER DR,TERRE HAUTE,IN,47802,,(812) 234-4315,97,3,0,98,91,7,2,94,86,11,3,94,80,17,3,92,,561,211,38,01/01/2022,12/31/2022
15C0001169,INDIANA SPECIALTY SURGERY CENTER LLC,1380 W ARCH HAVEN AVE,BLOOMINGTON,IN,47403,,(812) 330-1164,99,1,0,99,93,6,1,96,93,6,1,96,91,8,1,96,,888,352,40,01/01/2022,12/31/2022
15C0001174,METRO SPECIALTY SURGERY CENTER LLC,"200 MISSOURI AVE, STE. A",JEFFERSONVILLE,IN,47130,,(812) 920-0055,97,3,0,99,91,7,2,94,87,12,1,95,84,14,2,94,,1318,394,30,01/01/2022,12/31/2022
15C0001182,CARMEL SPECIALTY SURGERY CENTER,11590 NORTH MERIDIAN ST SUITE 130,CARMEL,IN,46032,,(317) 660-0260,96,4,0,98,89,9,2,93,87,11,2,94,83,15,2,93,,1612,523,32,01/01/2022,12/31/2022
15C0001184,MUNSTER SPECIALTY SURGERY CENTER,9200 CALUMET AVE SUITE S100,MUNSTER,IN,46321,,(219) 595-0789,98,2,0,99,92,6,2,95,87,11,2,95,85,13,2,94,,1024,341,33,01/01/2022,12/31/2022
15C0001186,MIDWEST SPECIALTY SURGERY CENTER LLC,6920 GATWICK DR STE 100,INDIANAPOLIS,IN,46241,,(317) 821-0000,98,2,0,99,90,8,2,94,92,7,1,96,91,8,1,96,,1170,633,54,01/01/2022,12/31/2022
15C0001188,NORTHWEST REGIONAL SURGERY CENTER LLC,"8900 BROADWAY, SUITE 100W",MERRILLVILLE,IN,46410,,(219) 576-6260,97,3,0,99,90,8,2,94,91,8,1,96,84,15,1,94,,1257,419,33,01/01/2022,12/31/2022
15C0001190,ADVANCED REGIONAL SURGERY CENTER LLC,"360 MISSOURI AVE, 19A, SUITE 102",JEFFERSONVILLE,IN,47130,,(817) 722-1480,95,4,1,97,89,9,2,93,84,14,2,94,80,17,3,92,,1608,411,26,01/01/2022,12/31/2022
15C0001202,GREAT LAKES SURGICAL SUITES LLC DBA GREAT LAKES SURGICAL SUITES,9200 CALUMET AVE SUITE N500,MUNSTER,IN,46321,,(219) 513-9955,95,5,0,97,90,9,1,95,84,14,2,93,79,16,5,91,,1014,354,35,01/01/2022,12/31/2022
15C0001214,FRANCISCAN LAKESHORE ASC LLC,12800 MISSISSIPPI PARKWAY PARVILION C,CROWN POINT,IN,46307,,(000) 000-0000,98,2,0,99,90,8,2,94,95,4,1,97,90,10,0,97,,1185,284,24,01/01/2022,12/31/2022
16C0001034,MERCY SURGERY CENTER LLC,1195 BOYSON RD SUITE 3,HIAWATHA,IA,52233,,(319) 369-4764,98,2,0,99,93,6,1,96,90,8,2,95,90,9,1,96,,1190,506,43,01/01/2022,12/31/2022
17C0001083,EPIC SURGERY CENTER,11261 NALL AVE SUITE 200,LEAWOOD,KS,66211,,(913) 671-3290,98,2,0,99,90,8,2,94,88,10,2,95,86,13,1,95,,990,388,39,01/01/2022,12/31/2022
19C0001010,EYE CARE SURGERY CENTER INC,10423 OLD HAMMOND HWY,BATON ROUGE,LA,70816,,(225) 932-0070,,,,,,,,,,,,,,,,,4;5,,,,,
19C0001053,METAIRIE OPHTHALMOLOGY ASC LLC,3900 VETERANS BLVD. #100,METAIRIE,LA,70002,,(504) 455-1550,,,,,,,,,,,,,,,,,4;5,,,,,
19C0001085,LAKE AMBULATORY SURGERY CTR,7145 PERKINS RD,BATON ROUGE,LA,70808,,(225) 408-5548,96,4,0,98,91,8,1,95,86,12,2,94,83,16,1,94,2,2348,583,25,01/01/2022,12/31/2022
19C0001092,ADVANCED SURGICAL CONCEPTS LLC,9118 BLUEBONNET CENTRE BLVD,BATON ROUGE,LA,70809,,(225) 368-2330,,,,,,,,,,,,,,,,,4,,,,,
19C0001109,CHRISTUS CABRINI SURGERY CENTER LLC,3436 MASONIC DR.,ALEXANDRIA,LA,71301,,(318) 427-6500,98,2,0,99,93,6,1,96,94,4,2,96,91,7,2,96,,1236,375,30,01/01/2022,12/31/2022
19C0001133,OIL CENTER SURGICAL PLAZA,1000 WEST PINHOOK,LAFAYETTE,LA,70503,,(337) 571-0600,97,3,0,99,93,6,1,96,90,9,1,96,88,11,1,95,,978,388,40,01/01/2022,12/31/2022
20C0001012,INTERMED PA DBA GENERATIONS,84 MARGINAL WAY SUITE 1000,PORTLAND,ME,04101,,(207) 347-2898,99,1,0,99,95,4,1,97,92,7,1,96,90,8,2,96,,883,279,32,01/01/2022,12/31/2022
21C0001043,KAISER FOUNDATION HEALTH PLAN OF THE MID-ATLANTIC STATES INC.,10810 CONNECTICUT AVE,KENSINGTON,MD,20895,,(301) 816-7284,97,2,1,98,95,4,1,97,87,10,3,95,84,14,2,93,,2054,736,36,01/01/2022,12/31/2022
21C0001063,CLINICAL ASSOCIATION AMBULATORY SURGICAL CENTER,515 FAIRMOUNT AVE. STE 100,TOWSON,MD,21286,,(410) 494-1335,95,4,1,97,92,7,1,95,81,16,3,94,80,17,3,93,,1212,111,9,01/01/2022,12/31/2022
21C0001466,UPPER BAY SURGERY CENTER LLC,360 EAST PULASKI HWY SUITE 2A,ELKTON,MD,21921,,(410) 620-3348,98,2,0,99,90,8,2,94,91,8,1,96,87,12,1,95,,1419,383,27,01/01/2022,12/31/2022
21C0001476,SURGCENTER OF GLEN BURNIE LLC,308 HOSPITAL DR SUITE 102,GLEN BURNIE,MD,21061,,(410) 760-8100,96,3,1,98,90,8,2,94,87,12,1,95,83,16,1,94,,1329,367,28,01/01/2022,12/31/2022
21C0001477,WESTMINSTER SURGERY CENTER,826 WASHINGTON RD STE 131,WESTMINSTER,MD,21157,,(410) 871-9440,98,2,0,99,93,6,1,96,92,7,1,96,90,9,1,96,,1001,373,37,01/01/2022,12/31/2022
21C0001491,MAPLE LAWN SURGERY CENTER,7625 MAPLE LAWN BLVD STE. 110,FULTON,MD,20759,,(301) 490-5025,98,2,0,99,95,4,1,97,93,6,1,97,90,9,1,96,,1315,382,29,01/01/2022,12/31/2022
21C0001494,SURGCENTER OF SOUTHERN MARYLAND,9001 WOODYARD RD SUITE B,CLINTON,MD,20735,,(301) 868-4950,97,2,1,98,91,7,2,95,82,14,4,92,78,19,3,91,,1437,425,30,01/01/2022,12/31/2022
21C0001498,TIMONIUM SURGERY CENTER LLC,"1954 GREENSPRING DR, LL18",TIMONIUM,MD,21093,,(410) 560-3301,96,4,0,98,90,8,2,94,89,10,1,95,83,15,2,93,,1428,440,31,01/01/2022,12/31/2022
21C0001508,PICCARD SURGERY CENTER LLC,1330 PICCARD DR STE 102,ROCKVILLE,MD,20850,,(301) 208-7350,96,4,0,98,88,9,3,93,90,9,1,95,89,10,1,96,,1416,332,23,01/01/2022,12/31/2022
21C0001519,SURGCENTER OF WHITE MARSH LLC,11605 CROSSROADS CIR,BALTIMORE,MD,21220,,(410) 344-0003,97,2,1,98,94,5,1,97,92,7,1,96,91,7,2,96,,713,198,28,01/01/2022,12/31/2022
21C0001524,LEONARDTOWN SURGERY CENTER LLC,"40900 MERCHANTS LANE, SUITE 200",LEONARDTOWN,MD,20650,,(301) 690-2203,97,3,0,99,94,5,1,96,88,11,1,95,87,11,2,94,,1480,407,28,01/01/2022,12/31/2022
21C0001525,HAGERSTOWN SURGERY CENTER LLC,11236 ROBINWOOD DR SUITE 201,HAGERSTOWN,MD,21742,,(240) 347-4836,,,,,,,,,,,,,,,,,4,,,,,
21C0001531,SURGCENTER OF SILVER SPRING LLC,8710 CAMERON ST STE 100,SILVER SPRING,MD,20910,,(301) 326-2921,,,,,,,,,,,,,,,,,4,,,,,
21C0001538,ADVANCED SURGERY CENTER OF BETHESDA LLC,6430 ROCKLEDGE DR SUITE 160,BETHESDA,MD,20817,,(301) 312-6144,95,5,0,98,89,9,2,94,73,24,3,90,69,27,4,87,,1296,240,19,01/01/2022,12/31/2022
21C0001539,GAITHERSBURG AMBULATORY SURGERY CENTER,655 WATKINS MILL RD,GAITHERSBURG,MD,20879,,(301) 816-6812,98,2,0,99,94,5,1,97,90,8,2,95,86,11,3,94,,2615,713,27,01/01/2022,12/31/2022
21C0001545,WINDSOR MILL SURGERY CENTER LLC,2373 NORTH ROLLING RD,WINDSOR MILL,MD,21244,,(443) 200-5600,,,,,,,,,,,,,,,,,4,,,,,
21C0001551,MONOCACY SURGERY CENTER LLC,4991 NEW DESIGN RD SUITE 103,FREDERICK,MD,21703,,(301) 363-5858,98,2,0,99,92,7,1,96,93,7,0,96,91,8,1,96,,1023,278,27,01/01/2022,12/31/2022
21C0001556,KAISER FOUNDATION HEALTH PLAN OF THE MID-ATLANTIC STATES INC,1221 MERCANTILE LANE,LARGO,MD,20774,,(301) 618-5500,96,3,1,98,94,5,1,97,88,10,2,95,83,15,2,93,,2924,706,24,01/01/2022,12/31/2022
21C0001560,SOUTH BALTIMORE COUNTY ASC LBN KAISER FOUNDATION HEALTH PLAN OF THE MID-ATLANTIC STATES INC,1701 TWIN SPRINGS RD,HALETHORPE,MD,21227,,(301) 816-2424,95,4,1,97,90,9,1,94,87,11,2,94,79,18,3,91,,2330,557,24,01/01/2022,12/31/2022
21C0001566,POTOMAC VIEW SURGERY CENTER LLC,6710 OXON HILL RD SUITE 150,OXON HILL,MD,20745,,(240) 766-2734,,,,,,,,,,,,,,,,,4,,,,,
21C0001568,POINT OF ROCKS SURGERY CENTER LLC,1901 LOCKHOUSE DR,POINT OF ROCKS,MD,21777,,(301) 874-2211,97,3,0,99,91,7,2,95,89,11,0,95,85,14,1,94,,746,231,31,01/01/2022,12/31/2022
21C0001575,SURGCENTER OF THE POTOMAC LLC,6508 ROCK SPRING DR STE 100,BETHESDA,MD,20817,,(240) 783-0282,,,,,,,,,,,,,,,,,4,,,,,
21C0001583,GLEN ECHO SURGERY CENTER,5550 FRIENDSHIP BLVD SUITE 100,CHEVY CHASE,MD,20815,,(240) 534-2972,97,3,0,99,92,7,1,96,91,6,3,95,84,12,4,93,,984,217,22,01/01/2022,12/31/2022
21C0001590,DIALYSIS ACCESS SERVICES LLC,1666 SULPHUR SPRINGS RD,BALTIMORE,MD,21227,,(410) 536-5400,96,4,0,98,89,9,2,94,90,8,2,94,85,11,4,92,3,575,83,14,01/01/2022,12/31/2022
21C0001594,DIALYSIS ACCESS SERVICES LLC,2405 YORK RD SUITE 100,TIMONIUM,MD,21093,,(410) 536-5400,95,3,2,97,88,8,4,92,81,14,5,92,76,16,8,87,3,479,72,15,01/01/2022,12/31/2022
22C0001011,ARC WORCESTER CENTER LP DBA WORCESTER SURGICAL CENTER,300 GROVE ST,WORCESTER,MA,01605,,(508) 754-0700,97,2,1,98,91,7,2,95,87,11,2,94,84,14,2,94,,1124,418,37,01/01/2022,12/31/2022
23C0001020,SURGICAL CARE CENTER OF MICHIGAN,750 EAST BELTLINE NE,GRAND RAPIDS,MI,49525,,(616) 588-6520,96,4,0,98,83,14,3,90,87,11,2,94,87,11,2,95,,1448,362,26,01/01/2022,12/31/2022
23C0001027,LAKE LANSING ASC PARTNERS LLC,1707 LAKE LANSING RD,LANSING,MI,48912,,(517) 708-3363,98,2,0,99,92,6,2,95,91,7,2,96,91,8,1,96,2,1026,363,35,01/01/2022,12/31/2022
23C0001031,GENESIS SURGERY CENTER,3400 E JOLLY RD,LANSING,MI,48910,,(517) 272-1063,96,4,0,98,92,7,1,95,89,10,1,95,87,12,1,95,,1208,381,37,01/01/2022,12/31/2022
23C0001053,EAST PARIS SURGICAL CENTER LLC,1000 EAST PARIS AVE S.E.,GRAND RAPIDS,MI,49546,,(616) 464-3430,97,3,0,98,86,12,2,92,87,11,2,95,89,9,2,96,,1351,310,23,01/01/2022,12/31/2022
23C0001080,WALKER SURGICAL CENTER LLC,3300 WALKER VIEW DR.,WALKER,MI,49544,,(616) 588-6560,97,3,0,99,91,7,2,94,92,7,1,97,92,7,1,97,,1495,389,26,01/01/2022,12/31/2022
23C0001085,TOWNE CENTRE SURGERY CENTER LLC,4599 TOWN CENTER RD.,SAGINAW,MI,48604,,(989) 497-3096,97,3,0,99,86,10,4,91,90,9,1,96,89,10,1,96,,1765,380,22,01/01/2022,12/31/2022
23C0001109,CLARKSTON SURGERY CENTER,5701 BOW POINTE DR,CLARKSTON,MI,48346,,(248) 922-4800,99,1,0,99,91,7,2,94,92,5,3,95,89,10,1,96,,970,354,36,01/01/2022,12/31/2022
23C0001114,SURGICAL INSTITUTE OF MONROE,1051 SOUTH TELEGRAPH RD,MONROE,MI,48161,,(734) 244-5383,98,2,0,99,90,8,2,94,88,10,2,95,85,14,1,94,,1418,596,42,01/01/2022,12/31/2022
23C0001128,RED CEDAR SURGERY CENTER PLLC,5668 OKEMOS RD,HASLETT,MI,48840,,(517) 481-2883,,,,,,,,,,,,,,,,,4,,,,,
23C0001139,HEALTH POINTE,15100 WHITTAKER WAY,GRAND HAVEN,MI,49417,,(616) 935-6329,97,2,1,98,92,7,1,95,89,9,2,94,86,13,1,95,,1750,440,25,01/01/2022,12/31/2022
24C0001010,WILLMAR SURGERY CENTER,1320 SOUTH FIRST ST,WILLMAR,MN,56201,,(320) 235-6506,98,2,0,99,93,6,1,96,89,10,1,95,84,15,1,94,,2431,758,31,01/01/2022,12/31/2022
24C0001019,LANDMARK SURGERY CENTER,7115 TAMARACK RD SUITE 200,WOODBURY,MN,55125,,(651) 261-1717,,,,,,,,,,,,,,,,,4,,,,,
24C0001052,ILBNC SPECIAL PROCEDURES,15700 37TH AVE N STE. 210,PLYMOUTH,MN,55446,,(952) 814-6644,,,,,,,,,,,,,,,,,4,,,,,
24C0001060,CENTRACARE SURGERY CENTER LLC,1900 CENTRACARE CIR,ST CLOUD,MN,56303,,(320) 229-4964,99,1,0,99,94,5,1,97,91,8,1,95,86,13,1,95,,3017,968,32,01/01/2022,12/31/2022
24C0001078,VADNAIS HEIGHTS SURGERY CENTER,3580 ARCADE ST,VADNAIS HEIGHTS,MN,55127,,(651) 968-5662,,,,,,,,,,,,,,,,,4,,,,,
24C0001091,EAGAN SURGERY CENTER,2620 EAGAN WOODS DR,EAGAN,MN,55121,,(651) 968-5662,,,,,,,,,,,,,,,,,4,,,,,
25C0001028,SOUTHERN SURGERY CENTER,3688 VETERANS MEMORIAL DR SUITE 100,HATTIESBURG,MS,39401,,(601) 554-7533,,,,,,,,,,,,,,,,,4;5,,,,,
25C0001058,CENTER FOR DIGESTIVE HEALTH LLC,589 GARFIELD ST,TUPELO,MS,38801,,(662) 377-4173,97,3,0,99,92,7,1,95,90,9,1,96,90,9,1,96,,2017,492,24,01/01/2022,12/31/2022
26C0001021,CREEKWOOD SURGERY CENTER LP,211 NORTHEAST 54TH ST SUITE 100,KANSAS CITY,MO,64118,,(816) 988-2553,97,3,0,98,92,6,2,95,88,9,3,94,84,14,2,94,,1527,423,28,01/01/2022,12/31/2022
26C0001028,SAINT LUKES GI DIAGNOSTICS LLC,4321 WASHINGTON STE. 5600,KANSAS CITY,MO,64111,,(816) 416-8353,92,7,1,96,90,8,2,94,84,13,3,93,83,15,2,93,,1535,433,28,01/01/2022,12/31/2022
26C0001060,SOUTH COUNTY OUTPATIENT ENDOSCOPY SERVICES LP DBA SOUTH COUNTY OUTPATIENT ENDOSCOPY SERVICES,5139 MATTIS RD  SUITE 100,ST LOUIS,MO,63128,,(314) 729-9780,98,2,0,99,93,6,1,96,92,7,1,96,88,11,1,95,,1136,491,43,01/01/2022,12/31/2022
26C0001061,DES PERES SQUARE SURGERY CENTER,1050 OLD DES PERES RD. STE. 150,ST LOUIS,MO,63131,,(314) 569-2918,97,3,0,99,91,7,2,95,87,12,1,94,80,19,1,93,,2156,642,30,01/01/2022,12/31/2022
26C0001066,MIDWEST DIGESTIVE HEALTH CENTER LLC,3601 NORTHEAST RALPH POWELL RD,LEES SUMMIT,MO,64064,,(816) 251-1255,98,2,0,99,93,6,1,96,95,3,2,97,93,6,1,97,,1340,361,27,01/01/2022,12/31/2022
26C0001069,BRIARCLIFF AMBULATORY SURGERY CENTER LP DBA BRIARCLIFF SURGERY CENTER,4150 NORTH MULBERRY DR SUITE 100,KANSAS CITY,MO,64116,,(816) 214-4364,98,2,0,99,92,7,1,96,88,11,1,95,84,15,1,94,,1409,374,27,01/01/2022,12/31/2022
26C0001080,MID RIVERS SURGERY CENTER,5401 VETERANS MEMOIRAL PARKWAY,ST PETERS,MO,63376,,(636) 441-0906,96,3,1,98,92,6,2,95,91,8,1,96,88,10,2,95,,966,278,29,01/01/2022,12/31/2022
26C0001082,CHESTERFIELD SURGERY CENTER,17050 BAXTER RD SUITE 110,CHESTERFIELD,MO,63005,,(636) 537-0122,98,2,0,99,90,8,2,94,89,9,2,95,84,14,2,94,,1094,363,33,01/01/2022,12/31/2022
26C0001087,ADVANCED AMBULATORY SURGICAL CARE LP,"10448 OLD OLIVE ST RD, SUITE 100",CREVE COEUR,MO,63141,,(314) 743-8091,97,3,0,99,92,6,2,95,86,13,1,95,85,13,2,94,,916,245,27,01/01/2022,12/31/2022
26C0001088,SURGERY CENTER OF COLUMBIA LP,305 NORTH KEENE ST SUITE 107,COLUMBIA,MO,65201,,(573) 256-6272,98,2,0,99,93,6,1,96,88,12,0,96,87,13,0,96,,674,296,44,01/01/2022,12/31/2022
26C0001097,RIVERSIDE AMBULATORY SURGERY CENTER,100 VILLAGE SQUARE,HAZELWOOD,MO,63042,,(314) 373-8931,95,5,0,97,92,7,1,95,87,10,3,95,83,15,2,93,,1657,463,28,01/01/2022,12/31/2022
26C0001099,MANCHESTER AMBULATORY SURGERY CENTER LP DBA MANCHESTER SURGERY CENTER,1040 OLD DES PERES RD,DES PERES,MO,63131,,(314) 775-2264,,,,,,,,,,,,,,,,,4,,,,,
26C0001109,WEBSTER AMBULATORY SURGERY CENTER LP,520 S. ELM AVE.,WEBSTER GROVES,MO,63119,,(314) 962-3464,99,1,0,99,91,8,1,95,91,8,1,96,87,12,1,95,,975,293,30,01/01/2022,12/31/2022
26C0001112,FRONTENAC AMBULATORY SURGERY AND SPINE CARE CENTER LP DBA FRONTENAC SURGERY AND SPINE CARE CENTER,10435 CLAYTON RD SUITE 110,FRONTENAC,MO,63131,,(314) 995-3990,98,2,0,99,90,8,2,94,89,9,2,95,88,10,2,95,,1382,394,29,01/01/2022,12/31/2022
26C0001116,GATEWAY ENDOSCOPY CENTER LP,12855 N. 40 DR. STE. 150,ST LOUIS,MO,63141,,(314) 336-1130,99,1,0,100,94,5,1,96,95,4,1,98,94,5,1,98,,1176,441,38,01/01/2022,12/31/2022
26C0001117,TWIN CITIES AMBULATORY SURGERY CENTER LP,1101 W. GANNON DR.,FESTUS,MO,63028,,(636) 931-5997,98,2,0,99,92,7,1,96,89,9,2,95,84,13,3,93,,820,316,39,01/01/2022,12/31/2022
26C0001138,OLD TESSON SURGERY CENTER,12639 OLD TESSON SUITE 130,ST. LOUIS,MO,63128,,(314) 748-4225,97,2,1,98,91,7,2,95,90,8,2,95,85,14,1,95,,891,376,42,01/01/2022,12/31/2022
26C0001148,EMERSON SURGERY CENTER LLC,"633 EMERSON RD, SUITE 140",ST LOUIS,MO,63141,,(314) 991-9922,98,2,0,99,92,7,1,95,95,4,1,97,92,7,1,97,,1222,423,35,01/01/2022,12/31/2022
26C0001157,NORTH CAMPUS SURGERY CENTER LLC,"633 EMERSON RD., SUITE 120",CREVE COEUR,MO,63141,,(314) 991-2090,99,1,0,99,96,4,0,98,91,9,0,97,93,5,2,97,3,249,77,31,01/01/2022,12/31/2022
26C0001162,TOTAL JOINT CENTER OF THE NORTHLAND,200 NORTHEAST 54TH ST SUITE 200,KANSAS CITY,MO,64118,,(816) 499-8500,98,2,0,99,92,6,2,95,93,6,1,97,92,7,1,97,,418,220,53,01/01/2022,12/31/2022
26C0001167,ADVANCED SURGICAL CARE OF ST. LOUIS LLC,232 MAYFAIR PLAZA SHOPPING CENTER,FLORISSANT,MO,63033,,(314) 736-4344,99,1,0,100,90,7,3,93,92,7,1,96,85,14,1,95,2,665,218,33,01/01/2022,12/31/2022
27C0001020,YELLOWSTONE SURGERY CENTER LLC,1144 N. 28TH ST.,BILLINGS,MT,59101,,(406) 237-5900,98,1,1,99,91,7,2,95,90,10,0,96,87,13,0,95,,1272,364,29,01/01/2022,12/31/2022
27C0001028,YELLOWSTONE SURGERY CENTER LLC DBA YELLOWSTONE SURGERY CENTER WEST,1739 SPRING CREEK DRIVE,BILLINGS,MT,59102,,(000) 000-0000,,,,,,,,,,,,,,,,,4,,,,,
27C0001029,WEST BOZEMAN SURGERY CENTER LLC DBA BOZEMAN OUTPATIENT SURGERY CENTER,875 SOUTH COTTONWOOD ROAD SUITE 100,BOZEMAN,MT,59718,,(000) 000-0000,98,2,0,99,91,8,1,95,88,11,1,95,84,15,1,94,,1504,558,37,01/01/2022,12/31/2022
28C0001032,NORTH PLATTE SURGERY CENTER LLC,621 WEST FRANCIS ST,NORTH PLATTE,NE,69101,,(308) 534-5400,98,2,0,99,92,7,1,95,87,10,3,94,86,13,1,95,,1053,345,33,01/01/2022,12/31/2022
29C0001036,PARKWAY SURGERY CENTER,100 NORTH GREEN VALLEY PARKWAY SUITE 125,HENDERSON,NV,89074,,(702) 616-4950,97,3,0,98,90,8,2,94,90,9,1,95,84,14,2,93,,1449,321,22,01/01/2022,12/31/2022
29C0001073,DURANGO OUTPATIENT SURGERY CENTER,8530 WEST SUNSET RD SUITE 100,LAS VEGAS,NV,89113,,(702) 789-5700,98,2,0,99,90,9,1,94,93,6,1,97,92,7,1,97,,1055,209,20,01/01/2022,12/31/2022
29C0001102,PARKWAY SURGERY CENTER DBA PARKWAY SURGERY CENTER AT HORIZON RIDGE,10561 JEFFREYS ST SUITE 130,HENDERSON,NV,89052,,(702) 724-8900,96,4,0,98,89,8,3,93,87,10,3,94,83,14,3,93,,1838,382,21,01/01/2022,12/31/2022
30C0001014,DARTMOUTH-HITCHCOCK AMBULATORY SURGERY CENTER,100 HITCHCOCK WAY,MANCHESTER,NH,03104,,(603) 629-8127,99,1,0,99,93,6,1,96,94,5,1,96,92,7,1,97,,2082,571,27,01/01/2022,12/31/2022
30C0001031,DARTMOUTH HITCHCOCK NASHUA ENDOSCOPY CENTER,2300 SOUTHWOOD DR,NASHUA,NH,03063,,(603) 629-8127,98,2,0,99,92,6,2,95,90,9,1,96,91,8,1,97,,1253,340,27,01/01/2022,12/31/2022
30C0001042,NORTH ATLANTIC SURGICAL SUITES LLC,23 KEEYWAYDIN DRIVE,SALEM,NH,03079,,(603) 386-0272,99,1,0,99,92,7,1,95,94,5,1,97,91,8,1,96,,940,524,56,01/01/2022,12/31/2022
30C0001044,ATLANTIC COAST SURGICAL SUITES LLC,325-2 LAFAYETTE RD,SEABROOK,NH,03874,,(603) 218-1793,99,1,0,99,94,5,1,97,92,7,1,97,88,11,1,95,,412,191,46,01/01/2022,12/31/2022
31C0001035,BERGEN GASTROENTEROLOGY PC,"466 OLD HOOK RD, SUITE 1",EMERSON,NJ,07630,,(201) 967-8221,96,4,0,98,88,9,3,92,84,13,3,93,81,17,2,93,,1228,320,26,01/01/2022,12/31/2022
31C0001099,SHORE OUTPATIENT SURGICENTER LLC,360 ROUTE 70,LAKEWOOD,NJ,08201,,(732) 942-9835,97,3,0,98,87,9,4,92,88,11,1,95,86,13,1,95,,1052,332,32,01/01/2022,12/31/2022
31C0001118,CENTRAL JERSEY SURGERY CENTER LLC,97 CORBETT WAY,EATONTOWN,NJ,07724,,(732) 460-2777,98,1,1,99,91,7,2,95,86,13,1,94,89,9,2,95,2,355,150,42,01/01/2022,12/31/2022
31C0001126,SHREWSBURY SURGERY CENTER,655 SHREWSBURY AVE,SHREWSBURY,NJ,07702,,(732) 450-6000,99,1,0,99,91,7,2,94,91,8,1,96,91,9,0,97,,1536,451,29,01/01/2022,12/31/2022
31C0001147,SAME DAY SURGERY CENTER OF CENTRAL JERSEY LLC,225 MAY ST. UNIT C,EDISON,NJ,08837,,(732) 661-0570,97,3,0,98,90,7,3,93,86,12,2,94,85,13,2,94,,1714,420,25,01/01/2022,12/31/2022
31C0001150,ORTHOPAEDIC SURGERY CENTER OF NORTHWEST JERSEY LLC,3130 ROUTE 10 WEST STE. 200,DENVILLE,NJ,07834,,(973) 328-3475,97,2,1,98,90,8,2,94,89,9,2,95,86,12,2,94,,1308,361,28,01/01/2022,12/31/2022
31C0001152,HACKENSACK ENDOSCOPY CENTER,170 PROSPECTIVE AVE. STE 10,HACKENSACK,NJ,07601,,(201) 498-0030,96,3,1,98,88,9,3,92,88,9,3,95,90,9,1,96,,979,306,31,01/01/2022,12/31/2022
31C0001153,TOMS RIVER SURGERY CENTER,1430 HOOPER AVE SUITE 301,TOMS RIVER,NJ,08753,,(732) 240-2277,98,2,0,99,91,7,2,95,92,6,2,96,88,10,2,95,,1079,357,33,01/01/2022,12/31/2022
31C0001160,HAMILTON ENDOSCOPY AND SURGERY CENTER LLC,"1235 WHITE HORSE MERCERVILLE RD, SUITE 310",HAMILTON,NJ,08619,,(609) 581-6610,96,4,0,98,89,9,2,93,86,13,1,94,86,13,1,94,,860,264,31,01/01/2022,12/31/2022
31C0001162,SUBURBAN ENDOSCOPY CENTER LLC,799 BLOOMFIELD AVE.,VERONA,NJ,07044,,(973) 571-1600,98,2,0,99,90,8,2,94,91,9,0,96,89,10,1,96,,1159,294,25,01/01/2022,12/31/2022
31C0001193,LAKEWOOD SURGERY CENTER LLC,1215 ROUTE 70 SUITE 2000,LAKEWOOD,NJ,08701,,(732) 719-1800,98,2,0,99,92,7,1,95,89,10,1,95,84,15,1,94,,1587,491,31,01/01/2022,12/31/2022
31C0001197,METROPOLITAN NEW JERSEY LLC DBA METROPOLITAN SURGERY CENTER,433 HACKENSACK AVE,HACKENSACK,NJ,07601,,(201) 527-6800,96,3,1,97,90,8,2,94,82,15,3,93,82,17,1,93,,1580,347,22,01/01/2022,12/31/2022
31C0001199,CENTER FOR BONE AND JOINT SURGERY DBA NORTHERN MONMOUTH REGIONAL SURGERY CENTER LLC,195 ROUTE 9 SOUTH SUITE 210,MANALAPAN,NJ,07726,,(732) 921-2305,97,3,0,98,90,8,2,94,89,10,1,95,83,16,1,94,,915,294,32,01/01/2022,12/31/2022
31C0001205,PARAMUS ENDOSCOPY LLC DBA ENDOSCOPY CENTER OF BERGEN COUNTY,80 EISENHOWER DR SUITE 100,PARAMUS,NJ,07652,,(201) 336-1100,98,2,0,99,89,8,3,93,93,6,1,96,91,8,1,96,,1491,399,27,01/01/2022,12/31/2022
31C0001216,SOMERSET AMBULATORY SURGICAL CENTER,1 HWY 206 N,SOMERVILLE,NJ,08876,,(908) 393-8360,98,2,0,99,91,8,1,95,92,7,1,96,89,10,1,96,,1129,324,29,01/01/2022,12/31/2022
31C0001218,MILLENNIUM SURGICAL CENTER LLC,"2090 SPRINGDALE RD., SUITE A",CHERRY HILL,NJ,08003,,(856) 751-4555,97,2,1,98,93,5,2,96,88,9,3,95,85,14,1,94,,1692,358,21,01/01/2022,12/31/2022
31C0001253,KHS AMBULATORY SURGICAL CENTER,405 HURFFVILLE-CROSSKEYS RD SUITE 210,SEWELL,NJ,08080,,(856) 582-2072,98,2,0,99,92,6,2,95,90,9,1,95,88,10,2,95,,1405,554,39,01/01/2022,12/31/2022
31C0001261,COASTAL ENDO LLC,175 GUNNING RIVER RD,BARNEGAT,NJ,08005,,(609) 698-0700,98,2,0,99,95,4,1,97,93,5,2,96,91,8,1,96,,1385,435,31,01/01/2022,12/31/2022
31C0001269,SURGICAL SPECIALISTS AT PRINCETON LLC,136 MAIN ST. STE. 100,PRINCETON,NJ,08540,,(609) 853-2261,98,2,0,99,92,7,1,95,88,11,1,95,88,11,1,96,,1506,436,29,01/01/2022,12/31/2022
31C0001305,VANGUARD SURGICAL CENTER LLC,113 ESSEX ST.,MAYWOOD,NJ,07607,,(201) 291-9100,98,2,0,99,94,5,1,96,95,4,1,97,92,6,2,96,,1509,466,31,01/01/2022,12/31/2022
32C0001107,NEW MEXICO ORTHOPAEDIC SURGERY CENTER LP DBA NEW MEXICO ORTHOPAEDIC SURGERY CENTER,201 CEDAR ST SOUTHEAST SUITE 7650,ALBUQUERQUE,NM,87106,,(505) 724-4394,96,3,1,98,89,9,2,94,86,12,2,94,84,13,3,93,,1637,494,30,01/01/2022,12/31/2022
32C0001127,PRESBYTERIAN HOSPITAL ASC,201 CEDAR ST SOUTHEAST SUITE 7650,ALBUQUERQUE,NM,87106,,(505) 357-3567,,,,,,,,,,,,,,,,,4,,,,,
32C0001129,PRESBYTERIAN RUST MEDICAL CENTER ASC LLC DBA NEW MEXICO SURGERY CENTER MULTI SPECIALTY,2400 UNSER BOULEVARD SOUTHEAST SUITE 09100B,RIO RANCHO,NM,87124,,(000) 000-0000,,,,,,,,,,,,,,,,,4,,,,,
34C0001159,PRIVATE DIAGNOSTIC CLINIC PLLC,"BRIER CREEK MEDICAL PAVILLION, 10207 CERNY ST., ST",RALEIGH,NC,27617,,(919) 660-0620,98,1,1,99,93,5,2,95,93,6,1,96,89,10,1,96,,1005,207,21,01/01/2022,12/31/2022
34C0001165,WAKE ENDOSCOPY CENTER LLC,2601 LAKE DR. S 201,RALEIGH,NC,27607,,(919) 341-3529,95,4,1,97,91,8,1,95,82,16,2,94,86,12,2,94,,3887,491,13,01/01/2022,12/31/2022
34C0001174,REX SURGERY CENTER OF CARY LLC,1505 SOUTHWEST CARY PARKWAY SUITE 100,CARY,NC,27511,,(804) 814-9753,99,1,0,99,91,8,1,95,91,7,2,95,88,11,1,95,,2926,664,23,01/01/2022,12/31/2022
34C0001189,CAROLINA DIGESTIVE CARE,107 B MICA AVE,MORGANTON,NC,28655,,(828) 588-1166,,,,,,,,,,,,,,,,,4,,,,,
35C0001004,TRINITY HEALTH,1102 MAIN ST,WILLISTON,ND,58801,,(701) 572-7711,98,2,0,99,93,6,1,96,89,10,1,95,89,11,0,96,,508,197,39,01/01/2022,12/31/2022
36C0001051,OSU INTERNAL MEDICINE LLC,"3900 STONERIDGE LANE, SUITE D",DUBLIN,OH,43017,,(614) 366-5001,,,,,,,,,,,,,,,,,4,,,,,
36C0001080,TAYLOR STATION SURGICAL CENTER LTD,6150 EAST BROAD ST,COLUMBUS,OH,43213,,(614) 546-4777,,,,,,,,,,,,,,,,,4,,,,,
36C0001097,REYNOLDS ROAD SURGICAL CENTER LTD DBA WILDWOOD SURGICAL CENTER,"2865 NORTH REYNOLDS RD, SUITE 190",TOLEDO,OH,43615,,(419) 578-7547,98,2,0,99,94,5,1,96,93,6,1,96,91,8,1,96,,1554,557,36,01/01/2022,12/31/2022
36C0001155,NEW HORIZONS SURGERY CENTER LLC,1167 INDEPENDENCE AVE.,MARION,OH,43302,,(740) 375-5854,98,2,0,99,94,5,1,97,94,5,1,96,91,8,1,96,,1333,470,35,01/01/2022,12/31/2022
36C0001222,THE CHRIST HOSPITAL SPINE SURGERY CENTER LLC,4020 SMITH RD,NORWOOD,OH,45209,,(513) 619-5899,98,1,1,99,96,3,1,98,94,5,1,96,92,7,1,97,,1097,460,42,01/01/2022,12/31/2022
36C0001294,NORTHPOINTE SURGICAL SUITES LLC,3250 NORTHPOINTE DR,ZANESVILLE,OH,43701,,(740) 487-1823,98,2,0,99,93,6,1,96,93,6,1,96,90,10,0,97,,1315,598,46,01/01/2022,12/31/2022
