49C0001044,ST. MARY'S AMBULATORY SURGERY CENTER,1501 MAPLE AVE SUITE 300,RICHMOND,VA,23226,,(804) 287-7881,98,2,0,99,92,7,1,96,93,6,1,96,90,9,1,96,,1103,314,28,01/01/2022,12/31/2022
49C0001047,BON SECOURS SURGERY CENTER AT VIRGINIA BEACH LLC,828 HEALTHY WAY SUITE 115,VIRGINIA BEACH,VA,23462,,(757) 495-8070,98,2,0,99,94,5,1,96,93,5,2,96,89,9,2,95,,996,322,32,01/01/2022,12/31/2022
49C0001049,BON SECOURS SURGERY CENTER AT HARBOUR VIEW LLC DBA BON SECOURS SURGERY CENTER AT HARBOUR VIEW,5818 HARBOUR VIEW BLVD SUITE 102D,SUFFOLK,VA,23435,,(757) 215-0499,96,4,0,98,91,7,2,95,89,9,2,95,84,14,2,93,,691,216,31,01/01/2022,12/31/2022
49C0001062,NOVANT HEALTH HAYMARKET AMBULATORY SURGICAL CENTER,15225 HEATHCOTE BLVD,HAYMARKET,VA,20169,,(336) 277-8770,98,2,0,99,92,6,2,95,90,8,2,96,89,10,1,96,,1217,501,41,01/01/2022,12/31/2022
49C0001078,VCU HEALTH AMBULATORY SURGERY CENTER LLC,11958 WEST BROAD STREET 5TH FLOOR,HENRICO,VA,23233,,(804) 364-1007,,,,,,,,,,,,,,,,,4,,,,,
50C0001040,THE POLYCLINIC,1145 BROADWAY,SEATTLE,WA,98122,,(206) 329-1760,98,2,0,99,91,8,1,95,88,10,2,94,86,12,2,94,,1887,463,26,01/01/2022,12/31/2022
50C0001048,TACOMA AMBULATORY SURGERY CENTER,209 MARTIN LUTHER KING JR WAY,TACOMA,WA,98405,,(206) 596-3590,96,3,1,97,92,7,1,95,82,16,2,93,79,19,2,92,,2922,834,29,01/01/2022,12/31/2022
50C0001146,THE EVERETT CLINIC,3901 HOYT AVE,EVERETT,WA,98201,,(425) 259-0966,98,2,0,99,92,7,1,95,88,11,1,95,86,13,1,95,,2206,564,26,01/01/2022,12/31/2022
50C0001149,TRI-CITY REGIONAL SURGERY CENTER LLC,1096 GOETHALS DR,RICHLAND,WA,99352,,(509) 438-7283,,,,,,,,,,,,,,,,,4,,,,,
50C0001152,THE VANCOUVER CLINIC INC,700 NE 87TH AVE.,VANCOUVER,WA,98664,,(360) 397-3462,97,3,0,98,89,9,2,93,85,13,2,94,83,16,1,94,,7084,1771,25,01/01/2022,12/31/2022
50C0001190,GASTROENTEROLOGY ASSOCIATES LLC,500 LILLY RD NORTHEAST SUITE 204,OLYMPIA,WA,98506,,(360) 413-8250,98,2,0,99,92,7,1,95,91,7,2,96,90,9,1,96,,984,357,36,01/01/2022,12/31/2022
50C0001233,NORTHWEST ORTHOPAEDIC SPECIALISTS PS,601 WEST 5TH AVE SUITE 500,SPOKANE,WA,99204,,(509) 344-8672,97,3,0,99,93,7,0,97,93,6,1,96,96,4,0,98,,2807,542,19,01/01/2022,12/31/2022
50C0001243,THE DOCTOR'S CLINIC,2200 NW MYRHE RD,SILVERDALE,WA,98383,,(360) 830-1111,97,3,0,98,93,6,1,96,88,11,1,95,89,11,0,96,,1388,493,36,01/01/2022,12/31/2022
50C0001280,BELLEVUE AMBULATORY SURGERY CENTER,11511 NE 10TH ST,BELLEVUE,WA,98004,,(509) 241-7026,97,3,0,98,91,7,2,94,84,13,3,93,81,16,3,92,,3387,882,26,01/01/2022,12/31/2022
50C0001309,THE POLYCLINIC,"1229 MADISON ST., STE. 1660",SEATTLE,WA,98104,,(206) 320-6160,98,2,0,99,95,5,0,97,95,5,0,98,97,3,0,99,,924,188,21,01/01/2022,12/31/2022
50C0001311,PROVIDENCE SURGERY AND PROCEDURE CENTER,16528 EAST DESMET CT,SPOKANE VALLEY,WA,99216,,(509) 474-3732,97,3,0,98,92,7,1,95,92,6,2,96,90,9,1,96,,1552,406,26,01/01/2022,12/31/2022
50C0001315,FIRST HILL SURGERY CENTER LLC,1101 MADISON ST SUITE 200,SEATTLE,WA,98104,,(206) 320-6126,97,3,0,98,91,8,1,95,88,10,2,94,82,17,1,94,,876,253,30,01/01/2022,12/31/2022
50C0001319,THE POLYCLINC MOHS DERMATOLOGY,"1229 MADISON ST, SUITE 1090",SEATTLE,WA,98104,,(206) 860-5595,97,3,0,99,91,7,2,95,89,10,1,95,90,9,1,96,,1495,569,38,01/01/2022,12/31/2022
50C0001323,KADLEC REGIONAL MEDICAL CENTER,1351 FOWLER ST,RICHLAND,WA,99352,,(509) 438-7283,,,,,,,,,,,,,,,,,4,,,,,
50C0001327,THE EVERETT CLINIC,21401 72ND AVE WEST,EDMONDS,WA,98026,,(425) 258-3900,97,3,0,99,95,4,1,97,88,11,1,95,86,12,2,94,,2001,441,22,01/01/2022,12/31/2022
50C0001331,KADLEC REGIONAL MEDICAL CENTER DBA KADLEC AMBULATORY ENDOSCOPY CENTER LEE CAMPUS,1270 LEE BOULEVARD SUITE B,RICHLAND,WA,99352,,(731) 661-1211,,,,,,,,,,,,,,,,,4,,,,,
52C0001097,PAIN CENTERS OF WISCONSIN FORT ATKINSON LLC,1604 MADISON AVE.,FORT ATKINSON,WI,53538,,(414) 325-3749,99,1,0,100,93,7,0,97,93,7,0,96,93,7,0,98,2;3,163,46,28,01/01/2022,12/31/2022
52C0001109,WISCONSIN SPECIALTY SURGERY CENTER LLC,"7401 104TH AVE, STE. 100",KENOSHA,WI,53158,,(262) 697-1006,98,2,0,99,91,7,2,95,92,7,1,96,89,10,1,96,,1386,480,35,01/01/2022,12/31/2022
52C0001125,NORTH SHORE SURGICAL SUITES,8400 LAKEVIEW PARKWAY,PLEASANT PRAIRIE,WI,53158,,(262) 455-7548,99,1,0,100,94,5,1,97,88,11,1,95,87,11,2,95,,700,170,24,01/01/2022,12/31/2022
53C0001010,TETON OUTPATIENT SERVICES LLC,150 BUFFALO WAY,JACKSON,WY,83001,,(307) 733-8677,97,3,0,98,92,7,1,96,92,6,2,96,90,10,0,97,,1444,382,26,01/01/2022,12/31/2022
53C0001018,SHERIDAN SURGICAL CENTER LLC,1524 WEST 5TH ST,SHERIDAN,WY,82801,,(370) 672-7874,97,3,0,99,90,8,2,94,86,11,3,94,86,14,0,95,,972,394,41,01/01/2022,12/31/2022
55C0001055,SAN FERNANDO VALLEY SURGERY CENTER,11550 INDIAN HILLS RD SUITE 160,MISSION HILLS,CA,91345,,(818) 256-2100,95,4,1,97,87,10,3,92,82,15,3,93,78,20,2,91,,1536,383,25,01/01/2022,12/31/2022
55C0001083,SACRAMENTO MIDTOWN ENDOSCOPY CENTER,3941 J ST SUITE 460,SACRAMENTO,CA,95819,,(916) 733-6940,95,5,0,97,87,11,2,92,79,17,4,92,79,17,4,91,,1013,277,27,01/01/2022,12/31/2022
